{
  "pilot_id": "pilot_14",
  "pilot_title": "The Living Past: A Digital Twin for Environmental Storytelling and Conservation",
  "pilot_description": "This pilot creates a Heritage Digital Twin of the Japanese Tower in Laeken (Brussels) that reconstructs its historical interior and exterior and simulates the long-term environmental impact of natural light, temperature and humidity on its decorations. When operational, the system continuously acquires IoT sensor data, generates indoor climate forecasts, runs illumination simulations, assesses conservation risks and visualises all data layers on high-fidelity 3D/VR/AR models of the Tower. Pilot leader: KIK-IRPA. Partners: HOF, Pixelated Realities, PHASMATIC, PIN.",

  "operations": [

    {
      "operation_id": "operation_01",
      "operation_title": "Real-time IoT Environmental Monitoring",
      "operation_type": "Monitoring",
      "general_purpose": "Continuously acquire indoor and outdoor environmental data from the IoCT sensor network deployed in the Japanese Tower and register the data in the ARTEMIS Knowledge Base.",
      "description": "The IoCT sensor network continuously monitors indoor parameters (air temperature, surface temperatures, relative humidity, light levels in visual/infrared/ultraviolet, airborne dust particles, CO2 concentrations) and outdoor meteorological parameters (temperature, RH, rainfall, wind direction, wind speed, solar radiation) via an on-site weather station. Data is logged automatically at 10–15 minute intervals, stored locally in .csv or .txt and transmitted to the RHDT platform via MQTT. Each sensor node is registered as a unique asset in the ARTEMIS KB (NodeID, SensorID, LocationDesc, SensorType, DataTypes, DataUnits, DeploymentDate, Status, Interval, DatasetURL). System uptime target: >=90%. Data completeness target: >=95% of expected readings per day. Data transmission latency target: <5 seconds.",
      "concerns_heritage_entity": {
        "entity_id": "artemis_he_007"
      },
      "inputs": [
        {
          "object_label": "Raw indoor environmental sensor readings",
          "object_class": "HC12_Signal",
          "notes": "Signals from indoor HC9 Sensor instances monitoring temperature, RH, light levels (visual, IR, UV), dust particles and CO2. Transmitted via MQTT."
        },
        {
          "object_label": "Raw outdoor meteorological sensor readings",
          "object_class": "HC12_Signal",
          "notes": "Signals from the on-site weather station monitoring temperature, RH, rainfall, wind direction, wind speed and solar radiation. Transmitted via MQTT."
        }
      ],
      "outputs": [
        {
          "object_label": "Real-time indoor and outdoor environmental time-series dataset",
          "object_class": "HC24_Digital_Object",
          "notes": "Continuous multi-variable time-series data stream. Format: .csv / .txt locally; accessible via REST API (JSON or CSV). Logging interval: 10–15 minutes. Used as input to operation_02 and operation_04."
        }
      ],
      "implemented_using": [
        {
          "service_title": "IoCT Services",
          "service_identifier": "BEDP-07"
        }
      ],
      "used_devices": [
        {
          "device_label": "Indoor IoCT sensor nodes (temperature, RH, light, dust, CO2)",
          "device_type": "Node",
          "notes": "HC25 Node grouping multiple HC9 Sensor instances. Commercial off-the-shelf and custom-built sensors."
        },
        {
          "device_label": "On-site outdoor weather station",
          "device_type": "Sensor",
          "notes": "HC9 Sensor monitoring outdoor meteorological parameters."
        }
      ],
      "used_parameters": [
        {
          "parameter_set_label": "IoT data acquisition configuration",
          "parameter_type": "Data acquisition configuration",
          "values": {
            "logging_interval": "10–15 minutes",
            "transmission_protocol": "MQTT",
            "data_format": "CSV / JSON",
            "system_uptime_target": ">=90%",
            "data_completeness_target": ">=95% expected readings per day",
            "data_transmission_latency_target": "<5 seconds"
          }
        }
      ],
      "place": {
        "place_name": "Japanese Tower, Royal Castle Domain, Laeken, Brussels, Belgium",
        "latitude": 50.892928,
        "longitude": 4.361589,
        "place_identifier": "https://www.geonames.org/3174953"
      }
    },

    {
      "operation_id": "operation_02",
      "operation_title": "Predictive Indoor Climate Forecasting",
      "operation_type": "Simulation",
      "general_purpose": "Generate short-term forecasts of indoor temperature and relative humidity using the trained Predictive Indoor Climate AI model, fed with real-time IoT data and external weather forecast data.",
      "description": "The Predictive Indoor Climate AI Service (HC15 AI Component) uses the building-specific hygrothermal model — trained on at least one year of real IoT sensor data from the Japanese Tower — to generate 24-hour indoor climate forecasts. The model receives real-time IoT data from operation_01 and external weather forecast data as inputs. Each forecast run is registered in the ARTEMIS KB as a structured record (ForecastID, AssetID, ModelID, ForecastHorizon, InputClimateSource, InputDataURL, ForecastOutputURL, Curator, ForecastTimestamp). Forecast generation time target: <5 minutes. Accuracy targets: within ±1°C for temperature and ±5% RH.",
      "concerns_heritage_entity": {
        "entity_id": "artemis_he_007"
      },
      "inputs": [
        {
          "object_label": "Real-time indoor and outdoor environmental time-series dataset",
          "object_class": "HC24_Digital_Object",
          "notes": "Output of operation_01. Used as real-time input to drive the AI forecasting model."
        },
        {
          "object_label": "External weather forecast data",
          "object_class": "HC24_Digital_Object",
          "notes": "Retrieved from an external weather API (e.g. open-meteo.com). Specifies future outdoor climate conditions used as boundary conditions for the indoor forecast."
        }
      ],
      "outputs": [
        {
          "object_label": "24-hour indoor climate forecast dataset",
          "object_class": "HC24_Digital_Object",
          "notes": "Forecasted indoor temperature and RH time-series for the next 24 hours. Registered in the ARTEMIS KB as a forecast record. Accessible via REST API (JSON/CSV). Used as input to operation_04."
        }
      ],
      "implemented_using": [
        {
          "service_title": "Predictive Indoor Climate AI Service",
          "service_identifier": "BESS-07"
        }
      ],
      "used_parameters": [
        {
          "parameter_set_label": "Indoor climate forecasting parameters",
          "parameter_type": "AI model configuration",
          "values": {
            "forecast_horizon": "24 hours",
            "temperature_accuracy_target": "within ±1°C",
            "rh_accuracy_target": "within ±5% RH",
            "forecast_generation_time_target": "<5 minutes"
          }
        }
      ],
      "continued_from": "operation_01"
    },

    {
      "operation_id": "operation_03",
      "operation_title": "Historical and Predictive Illumination Simulation",
      "operation_type": "Simulation",
      "general_purpose": "Model historical solar paths and climate conditions to calculate the cumulative light dose on specific surfaces of the Japanese Tower, and simulate the impact of future climate scenarios or environmental control interventions.",
      "description": "The Illumination Simulation Service computes the cumulative light exposure on accurately mapped material surfaces within the 3D model of the Japanese Tower, using historical outdoor climate data (available back to 1905) and solar path modelling. The simulation produces spatial raster outputs (heatmaps) in GeoTIFF or NetCDF format, visualising where and how much light each surface has received over time. The same engine is used to model future climate scenarios and to simulate the impact of proposed environmental control interventions (e.g. window shading, UV-filtering films) before any physical implementation. The 3D model used as spatial input requires clean watertight mesh geometry. This operation runs independently of the real-time IoT stream (operation_01) but its outputs feed into operation_04 and operation_05.",
      "concerns_heritage_entity": {
        "entity_id": "artemis_he_007"
      },
      "inputs": [
        {
          "object_label": "Historical outdoor climate data (1905–present)",
          "object_class": "HC24_Digital_Object",
          "notes": "Available with varying levels of detail from 1905 onwards. Used as boundary conditions for the historical illumination simulation."
        },
        {
          "object_label": "3D model of the Japanese Tower ('as-built' and 'as-is' states)",
          "object_class": "HC8_3D_Model",
          "notes": "Clean watertight mesh geometry (.obj or .glb) with accurately mapped material surfaces. Serves as the spatial input for computing light dose per surface."
        },
        {
          "object_label": "Future climate projection data or intervention parameters",
          "object_class": "HC24_Digital_Object",
          "notes": "Used for future scenario simulations or virtual prototyping of environmental control interventions (e.g. shading solutions). May be provided as external climate projections or as user-defined HC23 Parameter Set instances."
        }
      ],
      "outputs": [
        {
          "object_label": "Cumulative light exposure heatmaps (historical and scenario-based)",
          "object_class": "HC7_Digital_Visual_Object",
          "notes": "Spatial raster outputs showing cumulative light dose per surface. Format: GeoTIFF or NetCDF. Used as input to operation_04 and operation_05."
        }
      ],